{"$schema":"https://json-schema.org/draft/2020-12/schema","$id":"https://schemas.dromio.dev/legacy-migration-report/v1.schema.json","type":"object","additionalProperties":false,"required":["schemaVersion","id","stageId","tenantId","applicationId","threadId","status","sourceDigest","projectionDigest","importedCounts","unsupportedFields","droppedSensitiveFields","references","createdAt"],"properties":{"schemaVersion":{"const":"dromio.legacy-migration-report.v1"},"id":{"type":"string","minLength":1},"stageId":{"type":"string","minLength":1},"tenantId":{"type":"string","minLength":1},"applicationId":{"type":"string","minLength":1},"threadId":{"type":"string","minLength":1},"status":{"enum":["staged","verified","activated","rolled_back"]},"sourceDigest":{"type":"string","pattern":"^sha256:[a-f0-9]{64}$"},"projectionDigest":{"type":"string","pattern":"^sha256:[a-f0-9]{64}$"},"importedCounts":{"type":"object","additionalProperties":{"type":"integer","minimum":0}},"unsupportedFields":{"type":"array","uniqueItems":true,"items":{"type":"string","minLength":1}},"droppedSensitiveFields":{"type":"array","uniqueItems":true,"items":{"type":"string","minLength":1}},"references":{"type":"array","items":{"type":"object","additionalProperties":false,"required":["kind","sourceId","status"],"properties":{"kind":{"enum":["message","turn","artifact","feedback","parent_thread"]},"sourceId":{"type":"string","minLength":1},"targetId":{"type":"string","minLength":1},"status":{"enum":["resolved","missing"]}}}},"createdAt":{"type":"string","format":"date-time"},"verifiedAt":{"type":"string","format":"date-time"},"activatedAt":{"type":"string","format":"date-time"},"rolledBackAt":{"type":"string","format":"date-time"}}}
