{"schemaVersion":"dromio.legacy-migration-report.v1","id":"report-1","stageId":"stage-1","tenantId":"tenant-1","applicationId":"app-1","threadId":"thread-1","status":"verified","sourceDigest":"sha256:aaaaaaaaaaaaaaaaaaaaaaaaaaaaaaaaaaaaaaaaaaaaaaaaaaaaaaaaaaaaaaaa","projectionDigest":"sha256:bbbbbbbbbbbbbbbbbbbbbbbbbbbbbbbbbbbbbbbbbbbbbbbbbbbbbbbbbbbbbbbb","importedCounts":{"threads":1,"items":2},"unsupportedFields":[],"droppedSensitiveFields":["events.0.payload.body"],"references":[{"kind":"message","sourceId":"old-1","targetId":"item-1","status":"resolved"}],"createdAt":"2026-01-01T00:00:00Z","verifiedAt":"2026-01-01T00:00:01Z"}
